"You are not yet limited contractually capable. You can ask your legal guardian to purchase.","Você ainda não está limitado contratualmente capaz.Você pode pedir ao seu tutor legal para comprar."
"You are not yet contractually capable. You can ask your legal guardian to purchase on your behalf.","Você ainda não é contratualmente capaz.Você pode pedir ao seu tutor legal para comprar em seu nome."
"Payment","Pagamento"
"Hide other payment for zero totals","Ocultar método de pagamento com total zero"
"Checkout Filters","Filtros para o Checkout"
"Only display if the shipping method Correios is offline","Exibir somente se o método do Correios estiver offline"
"Checks the legal age","Verifica a idade legal"
"Save Billing","Salvar faturamento"